{
  "verdict": "request_changes",
  "reviewed_base": "aff62abfca85ca873932fedcad1e65c29ab35730",
  "reviewed_head": "43bbf62e4186e5454048b6e4fb28e356374c2b00",
  "findings": [
    {
      "severity": "high",
      "file": "docs/discovery/data-dictionary.md",
      "line": 293,
      "evidence": "§1.4.2의 실제 carrier는 `Rate(fraction)`뿐이지만, 299~302행은 분자·분모의 provenance, 게시값/정책표 출처, 관측값/추천값 구분이 값과 함께 남는다고 요구한다. `fraction` 외에는 이를 나르는 필드나 sealed variant가 없고 §12.2의 `fraction` 행도 다시 이 산문으로 위임한다. 따라서 서로 다른 `FloorRate` 출처와 `BidRate` 기원을 런타임 값에서 구별할 수 없어 provenance가 손실된다. C-4.2는 이름 등재만 검사하므로 이 누락에도 PASS한다.",
      "required_fix": "율 값을 실제로 운반하는 타입 또는 envelope에 provenance와 출처 구분을 표현하라. 특히 게시/정책 `FloorRate`, 관측/추천 `BidRate`, 파생 율의 입력 provenance가 타입·필드 또는 sealed variant로 보존되도록 정의하고 §12.2에 등재하라."
    },
    {
      "severity": "high",
      "file": "docs/discovery/data-dictionary.md",
      "line": 163,
      "evidence": "상태 정본 `regression-ledger.md:1345`와 기록된 C-6.3 출력은 `OPEN-REG-05`를 활성으로 판정한다. 그러나 사전은 163~164행과 §11, §13.1에서 이를 닫혔다고 선언하고 checklist도 상류가 활성인 이유를 단순히 out_of_scope 미갱신으로 해석한다. 이번 리뷰 계약은 OPEN 상태가 정본과 어긋나면 정본이 이긴다고 명시하므로, 인용 문서가 활성 OPEN을 자체적으로 폐쇄한 결함이다.",
      "required_fix": "`OPEN-REG-05`를 정본과 같이 활성으로 서술하고 관련 closure·fixture 설명을 모두 정합화하라. 실제 폐쇄가 필요하면 먼저 소유 slice에서 authoritative ledger 상태를 갱신한 뒤 이를 인용하라."
    },
    {
      "severity": "medium",
      "file": "reports/evidence/m0/0c/scope.md",
      "line": 280,
      "evidence": "이 행은 U-7이 `OPEN-QUAL-05`를 닫았다고 쓰지만, 상태 정본 `capability-map.md:2987`, 기록된 C-6.3 출력, 같은 파일 252~253행과 checklist A5는 모두 이를 활성으로 취급한다. 현재 evidence 내부에서도 활성/폐쇄 서술이 직접 모순된다.",
      "required_fix": "U-7의 ‘다루지 않음/알려진 제한’ 결정과 OPEN의 현재 활성 상태를 구분해 서술하고 scope·checklist·결정 사본의 상태 표현을 정본에 맞춰 일관되게 하라."
    }
  ],
  "commands_run": [
    "pwd && git status --short --untracked-files=all && git rev-parse --verify aff62abfca85ca873932fedcad1e65c29ab35730^{commit} && git rev-parse --verify 43bbf62e4186e5454048b6e4fb28e356374c2b00^{commit} && git merge-base aff62abfca85ca873932fedcad1e65c29ab35730 43bbf62e4186e5454048b6e4fb28e356374c2b00 && git log --format='%H %s' aff62abfca85ca873932fedcad1e65c29ab35730..43bbf62e4186e5454048b6e4fb28e356374c2b00 -- docs/discovery/data-dictionary.md reports/evidence/m0/0c/ && git diff --stat aff62abfca85ca873932fedcad1e65c29ab35730 43bbf62e4186e5454048b6e4fb28e356374c2b00 -- docs/discovery/data-dictionary.md reports/evidence/m0/0c/ && git diff --name-status aff62abfca85ca873932fedcad1e65c29ab35730 43bbf62e4186e5454048b6e4fb28e356374c2b00 -- docs/discovery/data-dictionary.md reports/evidence/m0/0c/",
    "sed -n '96,139p' agent-workflow.md && sed -n '179,224p' v2-지침서.md && sed -n '50,76p' milestone-0.md && sed -n '98,130p' milestone-0.md && sed -n '1,180p' data-extract.md && sed -n '1,290p' reports/evidence/m0/0c/scope.md",
    "cat reports/evidence/m0/0c/codex-review-20260830T034122Z.json",
    "sed -n '1,620p' docs/discovery/data-dictionary.md",
    "sed -n '621,1100p' docs/discovery/data-dictionary.md",
    "sed -n '1251,1798p' docs/discovery/data-dictionary.md",
    "sed -n '1,260p' reports/evidence/m0/0c/checklist.md",
    "run_first_fence '## C-3 '; run_first_fence '### C-4.1 '; run_first_fence '### C-4.2 '; run_first_fence '## C-8 '; run_first_fence '### C-2.2 '",
    "git diff --check 2b05684..43bbf62 && git diff --check aff62ab..43bbf62",
    "for c in $(git log --format='%H' 2b05684..43bbf62 -- docs/discovery/data-dictionary.md reports/evidence/m0/0c/); do git show --name-only --format='' \"$c\"; done | sed '/^$/d' | sort -u",
    "CELLS=$(awk -F'|' '/^\\|/ {print $2}' reports/evidence/m0/0c/scope.md); for c in $(git log --format='%h' 2b05684..HEAD -- docs/discovery/data-dictionary.md reports/evidence/m0/0c/); do printf '%s\\n' \"$CELLS\" | grep -qF \"\\`$c\\`\" || git log --format='%h %s' -1 \"$c\"; done",
    "git diff --name-status 9c55ede618a3fd8f4d8c55471e82a20aad3f969f 43bbf62e4186e5454048b6e4fb28e356374c2b00 -- docs/discovery/data-dictionary.md reports/evidence/m0/0c/",
    "git worktree add --detach \"$review_tmp\" 9c55ede618a3fd8f4d8c55471e82a20aad3f969f",
    "rg -n -C 8 'OPEN-REG-05.*활성|OPEN-QUAL-05.*활성|활성.*OPEN-REG-05|활성.*OPEN-QUAL-05' reports/evidence/m0/0c/commands.md",
    "nl -ba docs/discovery/data-dictionary.md | sed -n '276,326p;1688,1710p'",
    "nl -ba reports/evidence/m0/0c/scope.md | sed -n '214,223p;248,258p;276,284p'",
    "nl -ba docs/discovery/regression-ledger.md | sed -n '1338,1348p'",
    "nl -ba docs/discovery/capability-map.md | sed -n '2980,3002p'",
    "git rev-parse HEAD && git status --short --untracked-files=all && git ls-files --others --exclude-standard && git worktree list --porcelain"
  ],
  "residual_risks": [
    "`bid-vector` symlink와 `_workspace/`가 없어 C-1·C-5·C-6·C-7·C-9 및 C-10의 환경 의존 검사를 독립 재실행하지 못했다. 문서가 밝힌 환경 제한과 일치하며 실행 불가 자체는 finding으로 세지 않았다.",
    "선언 SHA 전용 임시 worktree 생성은 공용 gitdir 쓰기 권한 부족으로 실패했다. 최종 `git status`, untracked 검사와 `git worktree list`에서 새 파일·등록·커밋이 남지 않았음을 확인했다.",
    "C-3·C-4.1·C-4.2·C-8과 C-2.2는 현재 트리에서 통과했고, 최종 worktree는 clean이다."
  ],
  "reviewer": {
    "cli_version": "codex-cli 0.149.0",
    "model": "gpt-5.6-sol (reasoning effort: high)"
  }
}
