{
  "verdict": "request_changes",
  "reviewed_base": "14686dbf3bff4085203ffdcd931564fd1e36edf0",
  "reviewed_head": "857e7767d45835a1c71b42805165f1a4e49be69f",
  "findings": [
    {
      "severity": "high",
      "file": "fixtures/manifest.yaml",
      "line": 3150,
      "evidence": "`classification_policy.authoritative`는 M0 산출 문서가 자체 도출한 규칙을 authoritative 근거로 인정하지 않는다. 그런데 `verdict-001`·`002`는 `CapacityHold`·`LowPriority`라는 정확한 `SkipReason` 어휘를 검증 대상으로 삼고 authoritative로 분류한다. 실제 운영자 결정 `OPEN-DEC-05`는 `하나의 Skip verdict + 필수 reason code`만 승인했으며 두 코드 값은 승인하지 않았다. 해당 값은 manifest가 인용한 `data-dictionary.md`의 자체 도출에서만 나온다. 따라서 미승인 enum 값이 M1 golden으로 고정된다.",
      "required_fix": "두 case를 구조화된 reason code의 존재와 구별만 검증하도록 합성·비업무 어휘로 좁히거나 `insufficient-evidence`로 내리고 uncovered axis를 기록한다. `CapacityHold`·`LowPriority`를 유지하려면 그 정확한 어휘를 사용자에게 명시 승인받아 근거를 기록하고 expected 해시·change_history를 갱신한다."
    },
    {
      "severity": "medium",
      "file": ".claude/skills/v2-slice-pipeline/SKILL.md",
      "line": 157,
      "evidence": "현재 규칙은 line 127~128에서 재작업 상한을 `5회 도달`로 변경했지만 Phase 5는 여전히 `Phase 4의 ... 총 4회`라고 하고, line 195의 에러 처리 표도 `총 4회 초과`라고 적는다. 같은 활성 workflow 안에 두 상한 표현이 남아 실행 레인이 어느 시점에 중단해야 하는지 모호하다.",
      "required_fix": "Phase 5와 에러 처리 표를 line 127~128의 단일 규칙인 `not-ready + request_changes 합계 5회 도달 시 중단`으로 맞추고, Codex 수정 2라운드 상한과의 우선순위는 그대로 명확히 유지한다."
    }
  ],
  "commands_run": [
    "git status --short --branch && git rev-parse 14686dbf3bff4085203ffdcd931564fd1e36edf0^{commit} && git rev-parse 857e7767d45835a1c71b42805165f1a4e49be69f^{commit} && git rev-parse HEAD",
    "git merge-base --is-ancestor 14686dbf3bff4085203ffdcd931564fd1e36edf0 857e7767d45835a1c71b42805165f1a4e49be69f && git rev-list --count 14686dbf3bff4085203ffdcd931564fd1e36edf0..857e7767d45835a1c71b42805165f1a4e49be69f",
    "git diff --stat 14686dbf3bff4085203ffdcd931564fd1e36edf0..857e7767d45835a1c71b42805165f1a4e49be69f",
    "git diff --name-status 14686dbf3bff4085203ffdcd931564fd1e36edf0..857e7767d45835a1c71b42805165f1a4e49be69f",
    "git log --oneline 14686dbf3bff4085203ffdcd931564fd1e36edf0..857e7767d45835a1c71b42805165f1a4e49be69f",
    "git ls-files --others --exclude-standard && git diff --check 14686dbf3bff4085203ffdcd931564fd1e36edf0..857e7767d45835a1c71b42805165f1a4e49be69f",
    "nl -ba agent-workflow.md; nl -ba v2-지침서.md; nl -ba milestone-0.md; nl -ba milestone-1.md; nl -ba data-extract.md",
    "nl -ba reports/evidence/m0/0e/{scope,commands,checklist,fixtures-scope,fixtures-commands}.md",
    "nl -ba reports/evidence/m0/0e/codex-review-20260830T224249Z.json",
    "git diff 14686dbf3bff4085203ffdcd931564fd1e36edf0..857e7767d45835a1c71b42805165f1a4e49be69f -- v2-지침서.md milestone-0.md milestone-1.md docs/adr docs/discovery/capability-map.md .claude CLAUDE.md",
    "awk manifest input/expected SHA-256 pairs | shasum -a 256 -c -",
    "python3 -c JSON parse of fixtures/input/*.json and fixtures/expected/*.json (126 files)",
    "jq -e over fixture JSON and fixtures/legacy-reference-index.json",
    "python3 fixtures/tools/check_legacy_numbers.py",
    "ruby YAML audit of fixtures/manifest.yaml: 63 unique cases, 39 authoritative, 24 insufficient-evidence, required keys/paths/hashes/classification-review invariants",
    "ruby Psych AST duplicate-key scan of fixtures/manifest.yaml",
    "python3 inline OPEN registry/§14 coverage audit: active 69, B 14, C 55, missing/extra/overlap empty",
    "SHA-256 and path-set audit of fixtures/legacy-reference-index.json against fixtures/manifest.yaml",
    "python3 audit of reports/evidence/m0/0a/codex-review-20260830T223932Z.json plus git ancestor checks for 6c6b3a2..cd5a456..6af7019",
    "jq -c semantic inspection of every fixture input/expected pair grouped by domain",
    "grep secret/privacy patterns under fixtures/",
    "test -e bid-vector; git -C bid-vector rev-parse ed4b06c^{commit}",
    "rg source decisions and authoritative `verifies` text across fixtures/manifest.yaml, reports/evidence/m0/0a2/decisions.md, v2-지침서.md, and discovery documents",
    "rg -n '총 4회|총 5회|상한.*[45]회|5회|4회' .claude CLAUDE.md agent-workflow.md",
    "git status --porcelain=v1 && git rev-parse HEAD"
  ],
  "residual_risks": [
    "clean worktree에는 legacy checkout이 없어 legacy-reference-index의 object ID를 실제 `ed4b06c` 저장소와 대조하지 못했다. 저장소 내부 해시와 manifest 경로 집합만 검증했다.",
    "24개 case는 `insufficient-evidence`, uncovered axis는 26개이며 observed/legacy-behavior case는 0개다. evidence 자체도 이 corpus만으로 `milestone-1.md:12`를 완전히 충족하지 못한다고 기록한다.",
    "모든 fixture의 case-level `approved_by_user`는 false이고 `codex_verdict`는 pending이다. 이번 판정은 해당 값을 자동 변경하거나 사용자 승인을 대신하지 않는다.",
    "이 range에는 production application/wiring이 없어 retry·멱등성·DB write·외부 side effect·contract runtime 동작은 실행 검증 대상이 아니었다."
  ],
  "reviewer": {
    "cli_version": "codex-cli 0.149.0",
    "model": "gpt-5.6-sol (reasoning effort: high)"
  }
}
