{
  "verdict": "request_changes",
  "reviewed_base": "48151b9c47e4f09286c4ee869977383fa4b23396",
  "reviewed_head": "fbdedb6f07454fb46cbd2dc5e193d44c7efabca1",
  "findings": [
    {
      "severity": "medium",
      "file": "reports/evidence/m0/0a3/scope.md",
      "line": 84,
      "evidence": "1차 리뷰 head와 현재 head 사이의 scope diff에서 A4가 `X-1 외 서술 무변경`에서 `§13의 해당 인계 행 밖 무변경`으로 바뀌었다. 실제로 추가된 F-4 수정은 같은 행의 `검증 방법`이며, 이 파일의 O-1 기록도 그것이 최초 계약에서는 X-1 밖이었다고 명시한다. 그런데 YAML의 in_scope는 여전히 `§13 X-1 서술 한정`이고, lines 94-97은 불변의 표현만 바뀌었으며 범위는 넓어지지 않았다고 주장한다. 따라서 운영자 승인과 변경 사실은 공개했지만, 의미 범위가 X-1에서 같은 행의 F-4까지 실질적으로 넓어진 사실을 현재 계약이 서로 모순되게 기록한다.",
      "required_fix": "YAML in_scope와 A4를 실제 승인 범위인 X-1 정정 및 F-4 조건부 검증 문면 수정으로 정확히 열거하고, 최초 계약보다 의미 범위가 넓어졌음을 명시한다. 같은 행 전체를 포괄하는 느슨한 경계는 제거한다."
    },
    {
      "severity": "medium",
      "file": "reports/evidence/m0/0a3/commands.md",
      "line": 242,
      "evidence": "C-3.1 명령을 현재 head에서 재실행하면 `capability-map.md:1373`의 살아 있는 §5 `추정가격(ex-VAT)` 단정이 출력된다. 같은 파일의 C-3.4 판정표도 이 항목을 `포함 — 부가세 제외 단정`으로 판정한다. 그런데 lines 243-246은 C-3.1의 모든 매치가 취소선·정정 설명·provenance·§13 원문 인용 중 하나라서 살아 있는 단정이 없다고 기록한다. line 248의 `capability-map.md 전체를 보지도 않는다`도 명령이 파일 전체를 grep한다는 사실과 다르다. checklist의 A1 pass가 C-3.1을 근거로 인용하므로 evidence의 현재 판정이 자체 출력과 모순된다.",
      "required_fix": "C-3.1을 실제 A1 범위인 decisions.md 정정 블록과 capability-map.md §13으로 한정하거나, 현재 출력에 §5의 살아 있는 out-of-scope 매치가 포함된다고 판정을 고친다. checklist의 A1 근거도 수정된 검사 범위와 동기화한다."
    },
    {
      "severity": "medium",
      "file": "reports/evidence/m0/0a3/commands.md",
      "line": 11,
      "evidence": "lines 11-16은 새 스윕 스크립트를 만들지 않았고 유일한 스크립트가 C-4 불변 계산기라고 현재형으로 주장하며, C-7 line 521도 이를 반복한다. 그러나 C-3.4 lines 304-342에는 `X-1 프레이밍 후보 스윕` Python 스크립트가 인라인돼 있고 실제로 재실행된다. checklist.md §12도 P-1 대응으로 이 축을 넓히고 본문을 C-3에 인라인했다고 기록한다. 따라서 evidence의 스크립트 자기 인벤토리가 현재 head에서 거짓이다.",
      "required_fix": "commands.md 머리와 C-7을 현재 실물에 맞춰 갱신해 C-3.4 스윕과 C-4 불변 계산기의 목적·도입 근거를 각각 정확히 기록한다."
    }
  ],
  "commands_run": [
    "git status --short && git rev-parse --verify 48151b9c47e4f09286c4ee869977383fa4b23396^{commit} && git rev-parse --verify fbdedb6f07454fb46cbd2dc5e193d44c7efabca1^{commit} && git rev-parse HEAD && git merge-base 48151b9c47e4f09286c4ee869977383fa4b23396 fbdedb6f07454fb46cbd2dc5e193d44c7efabca1",
    "git log --oneline 48151b9c47e4f09286c4ee869977383fa4b23396..fbdedb6f07454fb46cbd2dc5e193d44c7efabca1 && git diff --stat 48151b9c47e4f09286c4ee869977383fa4b23396...fbdedb6f07454fb46cbd2dc5e193d44c7efabca1 && git diff --name-status 48151b9c47e4f09286c4ee869977383fa4b23396...fbdedb6f07454fb46cbd2dc5e193d44c7efabca1 && git ls-files --others --exclude-standard",
    "git diff --unified=30 cb1be885051850314680f7f6b47a8953b1fed252..fbdedb6f07454fb46cbd2dc5e193d44c7efabca1 -- reports/evidence/m0/0a3/scope.md",
    "git diff --unified=25 48151b9c47e4f09286c4ee869977383fa4b23396...fbdedb6f07454fb46cbd2dc5e193d44c7efabca1 -- docs/discovery/capability-map.md reports/evidence/m0/0a2/checklist.md reports/evidence/m0/0a2/decisions.md",
    "git diff --check 48151b9c47e4f09286c4ee869977383fa4b23396...fbdedb6f07454fb46cbd2dc5e193d44c7efabca1",
    "git diff --name-only 48151b9c47e4f09286c4ee869977383fa4b23396...fbdedb6f07454fb46cbd2dc5e193d44c7efabca1 && git diff --numstat 48151b9c47e4f09286c4ee869977383fa4b23396...fbdedb6f07454fb46cbd2dc5e193d44c7efabca1 -- docs/discovery/capability-map.md && git diff -U0 48151b9c47e4f09286c4ee869977383fa4b23396...fbdedb6f07454fb46cbd2dc5e193d44c7efabca1 -- docs/discovery/capability-map.md | rg '^@@'",
    "git diff -U0 6a4e49b -- reports/evidence/m0/0a2/decisions.md | rg '^@@'",
    "commands.md C-4의 `0A3 A4 불변` Python 블록을 marker로 추출해 현재 head와 `git archive 48151b9` 양쪽에서 stdin 실행",
    "commands.md C-3.4의 `X-1 프레이밍 후보 스윕` Python 블록을 marker로 추출해 현재 head에서 stdin 실행",
    "grep -nE 'ex-VAT|VAT·사정률만큼' docs/discovery/capability-map.md reports/evidence/m0/0a2/decisions.md",
    "grep/awk/sed로 reports/evidence/m0/0b/commands.md C-8.1·C-8.2·C-8.5·C-9.9, scope.md F-1·F-2, regression-ledger.md R-BASIS-01 검증 방법을 재확인",
    "jq '.findings' reports/evidence/m0/0b/codex-review-20260827T064055Z.json && for f in reports/evidence/m0/0b/codex-review-*.json; do jq -r '.verdict' \"$f\"; done"
  ],
  "residual_risks": [
    "이 worktree에는 legacy `bid-vector` 저장소가 없어 `ed4b06c`의 파일·행 범위와 인용 원문을 독립 재현하지 못했다. 요청에 명시된 환경 한계이므로 finding으로 계상하지 않았다.",
    "scope.md O-2가 범위 밖으로 둔 capability-map.md §5·§6·§7의 VAT/basis 프레이밍은 현재 head에도 남아 있다. 이번 slice의 선언된 산출물 수정 범위 밖이므로 finding에 섞지 않았다.",
    "문서 slice이므로 production wiring의 side effect, retry/idempotency, unknown-schema 계약, Kotlin/Python 업무 규칙 소유와 domain 의존 방향은 이번 range에서 검증할 구현이 없다."
  ],
  "reviewer": {
    "cli_version": "codex-cli 0.149.0",
    "model": "gpt-5.6-sol (reasoning effort: high)"
  }
}
