{
  "verdict": "request_changes",
  "reviewed_base": "6af7019996ec26903c7b531ed7ede12c22cf176e",
  "reviewed_head": "16d690b2de8d91b1da5f267b03fb57f1981b27c8",
  "findings": [
    {
      "severity": "high",
      "file": "docs/discovery/capability-map.md",
      "line": 931,
      "evidence": "활성 `OPEN-QUAL-09`는 시공능력평가금액 미달을 즉시 `Ineligible`로 볼지 적격심사 점수로 볼지 미결이라고 §12에서 명시한다. 그러나 QUAL-11의 사용자 가치는 이미 미달 공고를 자격 단계에서 거른다고 확정하고, acceptance도 비교 결과를 `Eligible`/`Ineligible`/`Uncertain` 자격 어휘로 고정한다. 결정 기록은 자격 축과 적합도 축의 분리만 승인했으므로 활성 OPEN의 (a) 분기를 확정 서술이 선점한다.",
      "required_fix": "QUAL-11의 사용자 가치와 acceptance에서 `OPEN-QUAL-09`가 결정하지 않은 미달 처리를 조건부로 분리하거나, 해당 처리에 대한 운영자 결정을 authoritative 기록에 추가하고 본문·§12를 일관되게 갱신한다."
    },
    {
      "severity": "high",
      "file": "docs/discovery/capability-map.md",
      "line": 953,
      "evidence": "신규 필수 입력인 `cnstrtnAbltyEvlAmtList` 요구 금액과 운영자 보유액을 직접 비교하도록 확정했지만, 저장소 내 해당 필드 서술에는 currency/unit, basis, VAT treatment, provenance 정의도 대응 OPEN도 없다. §13의 0C 인계만으로는 milestone-0의 '모든 도메인 숫자는 unit/basis/provenance가 정의되거나 OPEN' 조건과 `v2-지침서.md` §4.1의 Money 계약을 충족하지 못한다.",
      "required_fix": "공식 근거로 두 금액의 unit/basis/VAT/provenance를 정의해 acceptance에 포함하거나, 미확정 의미를 활성 OPEN으로 등록하고 정의 전에는 비교 결과를 확정하지 않는다."
    },
    {
      "severity": "high",
      "file": "docs/discovery/capability-map.md",
      "line": 2210,
      "evidence": "authoritative 결정은 V2에 메시지 브로커를 두지 않고 스케줄·outbox·재시도를 DB 기반으로 구현한다고 명시한다. 그런데 V2 제약은 여전히 `브로커 timeout`을 시간 예산에 포함하고, OPS-04 acceptance는 브로커 응답·passive queue semantics를 요구하며, OPS-21은 브로커 큐 깊이 바인더를 후보로 유지한다. 기록된 OPS-06 인계만으로는 OPS-02·OPS-04의 실행 불가능한 broker 전제를 해소하지 못한다.",
      "required_fix": "V2-facing OPS-02·OPS-04·OPS-21의 broker 전제를 DB 기반 backlog/timeout/관측 계약으로 정합화한다. DB 큐 설계 전 확정할 수 없는 부분은 명시적 OPEN 또는 조건부 acceptance로 남기고 관련 집계·인계를 갱신한다."
    },
    {
      "severity": "high",
      "file": "docs/discovery/capability-map.md",
      "line": 2909,
      "evidence": "`OPEN-QUAL-02` 결정은 `permsnIndstrytyList`를 자격 경로에 포함하는 것이지만, §12.2 표 외의 QUAL capability 본문에는 이 결정이나 관찰 가능한 acceptance가 반영되지 않았다. 같은 행은 '허용 업종 보유만으로 충족인지 제한 면허와 함께여야 하는지 문서에 없다'는 미결 업무 의미도 인정하면서 이를 활성 OPEN으로 등록하지 않고 단순히 versioned policy가 정한다고 넘긴다. 구현자가 근거 없이 자격 규칙을 선택할 수 있다.",
      "required_fix": "`permsnIndstrytyList` 포함 결정을 해당 QUAL capability의 입력·acceptance에 반영하고, 단독 충족과 결합 충족 중 어느 의미인지 authoritative 근거로 확정하거나 별도 활성 OPEN으로 등록한다."
    },
    {
      "severity": "medium",
      "file": "docs/discovery/capability-map.md",
      "line": 2582,
      "evidence": "`decisions.md`는 `OPEN-OPS-07`이 결정이 아니라 실행으로 닫히며 ADR 대안 절에 조사 결과가 기록되면 종료된다고 명시한다. 현재 저장소에는 ADR 산출물이 없고 이 문단도 ADR 기입이 남았다고 인정하지만, 동시에 `OPEN-OPS-07 해소`라고 선언하고 활성 목록에서 제거했다. 같은 문단 안에서 종료 조건 미충족과 해소가 모순되며 M0 차단 수를 과소 계상한다.",
      "required_fix": "ADR 기록이 커밋될 때까지 `OPEN-OPS-07`을 활성 실행 게이트로 복원해 집계를 고치거나, 범위가 승인된 별도 변경에서 요구된 ADR 대안 절을 실제로 기록한 뒤 해소 상태를 유지한다."
    },
    {
      "severity": "medium",
      "file": "reports/evidence/m0/0a2/checklist.md",
      "line": 64,
      "evidence": "A3 증명은 legacy에 STR-16 대응 구현이 없고 검색·목록 관련 항목이 COL-01·QUAL-10뿐이라고 여전히 주장한다. 그러나 같은 checklist의 수정 이력과 최종 capability map은 라이브 `GET /projects/` 검색 경로와 별도 `POST /predictions/price` 요청 경로가 존재해 이 부재 주장이 반증됐다고 기록한다. 자기진단이 찾은 오류가 최상위 acceptance 대조에 남아 evidence 사실 주장이 내부 모순이다.",
      "required_fix": "A3 대조를 최종 실측 내용인 '검색과 투찰가 요청은 각각 존재하지만 결합 경로가 없다'로 교체하고, 상단 산출물 줄 수 등 최종 HEAD와 어긋난 요약 메타데이터도 함께 갱신한다."
    }
  ],
  "commands_run": [
    "git status --short --branch",
    "git rev-parse HEAD",
    "git cat-file -t 6af7019996ec26903c7b531ed7ede12c22cf176e && git cat-file -t 16d690b2de8d91b1da5f267b03fb57f1981b27c8",
    "git log --oneline --decorate --no-merges 6af7019996ec26903c7b531ed7ede12c22cf176e..16d690b2de8d91b1da5f267b03fb57f1981b27c8",
    "git diff --stat 6af7019996ec26903c7b531ed7ede12c22cf176e...16d690b2de8d91b1da5f267b03fb57f1981b27c8",
    "git diff --name-status 6af7019996ec26903c7b531ed7ede12c22cf176e...16d690b2de8d91b1da5f267b03fb57f1981b27c8",
    "git ls-files --others --exclude-standard",
    "git merge-base 6af7019996ec26903c7b531ed7ede12c22cf176e 16d690b2de8d91b1da5f267b03fb57f1981b27c8",
    "git rev-list --count 6af7019996ec26903c7b531ed7ede12c22cf176e..16d690b2de8d91b1da5f267b03fb57f1981b27c8",
    "git diff --check 6af7019996ec26903c7b531ed7ede12c22cf176e...16d690b2de8d91b1da5f267b03fb57f1981b27c8",
    "nl -ba agent-workflow.md",
    "nl -ba milestone-0.md",
    "nl -ba v2-지침서.md",
    "nl -ba reports/evidence/m0/0a2/scope.md",
    "nl -ba reports/evidence/m0/0a2/decisions.md",
    "nl -ba reports/evidence/m0/0a2/checklist.md",
    "nl -ba reports/evidence/m0/0a2/commands.md",
    "git diff --unified=3 6af7019996ec26903c7b531ed7ede12c22cf176e...16d690b2de8d91b1da5f267b03fb57f1981b27c8 -- docs/discovery/capability-map.md",
    "python3 inline independent parser for classification counts, required acceptance sections, active OPEN sets, and §12.2 set equality",
    "rg -n \"OPEN-QUAL-09|시공능력평가|자격 단계에서 거|Ineligible\" docs/discovery/capability-map.md reports/evidence/m0/0a2/*.md",
    "rg -n -i \"브로커|broker|rabbit|queue topology\" docs/discovery/capability-map.md reports/evidence/m0/0a2/{decisions,scope,checklist}.md",
    "rg -n -C 5 \"permsnIndstrytyList|허용 업종\" docs/discovery/capability-map.md reports/evidence/m0/0a2/{decisions,scope,checklist}.md",
    "grep -rniE '(api[_-]?key|secret|token|password|Bearer |BEGIN (RSA|EC|OPENSSH))' docs/discovery/",
    "python3 inv2.py"
  ],
  "residual_risks": [
    "독립 집계로 분류 62/17/6/10, 필수 capability 결측 0, 활성 OPEN 39, base 대비 소멸 29·신설 2, §12.2 결정 집합과 소멸 집합의 일치를 재현했다.",
    "clean worktree에서 evidence가 기록한 `python3 inv2.py`는 파일 부재로 exit 2였다. 동일 불변식은 독립 inline parser로 재현했지만 evidence 명령 자체는 그대로 재실행할 수 없다.",
    "legacy `bid-vector`와 인용된 legacy commit 객체가 이 worktree에 없어 저장소 밖 파일·commit 주장은 재현하지 않았으며, 요청 지침에 따라 그 사실만으로 결함 판정하지 않았다.",
    "활성 OPEN 39건은 별도 사용자 승인 없이는 M1 진행 승인이 아니다. 이 리뷰 판정 역시 merge, 외부 호출, DB write, release 또는 배포 승인이 아니다."
  ],
  "reviewer": {
    "cli_version": "codex-cli 0.149.0",
    "model": "gpt-5.6-sol (reasoning effort: high)"
  }
}
